[
  { "id": "plant_bloodroot", "name": "Krwawnik", "description": "Czerwone ziele o właściwościach gojących. Rośnie na traktach.", "category": "plant", "value": 3, "weight": 0.1, "icon": "plant_bloodroot", "effect": "heal", "effect_value": 10, "biom": "road", "rarity": "common" },
  { "id": "plant_dewleaf", "name": "Rosa Liść", "description": "Srebrzysty liść zbierający poranną rosę. Łagodzi zatrucia.", "category": "plant", "value": 5, "weight": 0.1, "icon": "plant_dewleaf", "effect": "antidote", "effect_value": 1, "biom": "forest", "rarity": "common" },
  { "id": "plant_swamp_moss", "name": "Błotny Mech", "description": "Rosnący na kłodach w bagnie. Używany w miksturach many.", "category": "plant", "value": 8, "weight": 0.2, "icon": "plant_swamp_moss", "effect": "mana", "effect_value": 15, "biom": "swamp", "rarity": "uncommon" },
  { "id": "plant_ember_flower", "name": "Żarowiec", "description": "Czerwony kwiat rosnący w pobliżu Szczeliny. Ciepły w dotyku.", "category": "plant", "value": 25, "weight": 0.1, "icon": "plant_ember_flower", "effect": "buff_strength", "effect_value": 5, "effect_duration": 60, "biom": "special", "rarity": "rare" },
  { "id": "plant_frost_grass", "name": "Szadź Trawa", "description": "Zamarznięta trawa nawet w lecie. Rośnie tylko w cieniu gór.", "category": "plant", "value": 20, "weight": 0.1, "icon": "plant_frost_grass", "effect": "buff_dexterity", "effect_value": 5, "effect_duration": 60, "biom": "mountain", "rarity": "rare" },
  { "id": "plant_moonweed", "name": "Księżycowe Ziele", "description": "Kwitnie tylko w nocy. Silne właściwości regeneracyjne.", "category": "plant", "value": 15, "weight": 0.1, "icon": "plant_moonweed", "effect": "heal", "effect_value": 35, "biom": "forest", "rarity": "uncommon" },
  { "id": "plant_beach_vine", "name": "Morska Winorośl", "description": "Rośnie na plażach. Po wysuszeniu przywraca siły.", "category": "plant", "value": 4, "weight": 0.2, "icon": "plant_beach_vine", "effect": "stamina", "effect_value": 20, "biom": "beach", "rarity": "common" },
  { "id": "plant_poison_cap", "name": "Trujący Kapelusz", "description": "Grzyb o ostrym zapachu. Można zrobić truciznę... albo zjeść i pożegnać się ze światem.", "category": "plant", "value": 6, "weight": 0.1, "icon": "plant_poison_cap", "effect": "poison", "effect_value": 15, "biom": "swamp", "rarity": "common" },
  { "id": "plant_grave_moss", "name": "Cmentarny Mech", "description": "Rośnie tylko na starych grobach. Podobno czuje obecność śmierci.", "category": "plant", "value": 12, "weight": 0.1, "icon": "plant_grave_moss", "effect": "cure", "effect_value": 1, "biom": "cemetery", "rarity": "uncommon" },
  { "id": "plant_firethorn", "name": "Ognisty Cierń", "description": "Czerwony krzew z płonącymi kolcami. Używany do wzmacniania ognistych czarów.", "category": "plant", "value": 30, "weight": 0.2, "icon": "plant_firethorn", "effect": "buff_strength", "effect_value": 8, "effect_duration": 30, "biom": "mountain", "rarity": "rare" }
]
